{
  "$schema": "https://json-schema.org/draft/2020-12/schema",
  "$id": "https://contradish.com/schema/transition/1.1.json",
  "title": "Contradish Transition Contract",
  "description": "contradish's atomic object (contradish/transition.py): the governing information a system had (before), the governing information it has now (after), and for each case the outcome each warrants. Cases whose outcome is the same on both sides must persist; cases whose outcome differs must be revised. Each pair of cases is a distinction that the transition warrants to survive, collapse, emerge, or stay merged. A transition whose new information means the same as the old (meaning_preserving) is the null transition: everything persists. Distinct from the older `transition_contract` schema, which describes the derivation engine's warranted / not-warranted judgments for a scenario pair. Since 1.1 a contract may also say where the new information comes from and how it arrives (sources, update), and per case whether that source has governing authority over it: an update with no authority over a case warrants no change there, whatever it asserts.",
  "type": "object",
  "required": [
    "schema_version",
    "id",
    "before",
    "after",
    "outcomes",
    "cases"
  ],
  "additionalProperties": true,
  "properties": {
    "schema_version": {
      "type": "string",
      "pattern": "^[0-9]+\\.[0-9]+$"
    },
    "id": {
      "type": "string"
    },
    "domain": {
      "type": "string"
    },
    "description": {
      "type": "string"
    },
    "preamble": {
      "type": "string",
      "description": "Text placed before the governing information in the system prompt."
    },
    "meaning_preserving": {
      "type": "boolean",
      "description": "Declared null transition: no case may be revised."
    },
    "before": {
      "oneOf": [
        {
          "type": "string"
        },
        {
          "type": "object",
          "required": [
            "text"
          ],
          "additionalProperties": true,
          "properties": {
            "id": {
              "type": "string"
            },
            "text": {
              "type": "string"
            }
          }
        }
      ],
      "description": "The previous governing information."
    },
    "after": {
      "oneOf": [
        {
          "type": "string"
        },
        {
          "type": "object",
          "required": [
            "text"
          ],
          "additionalProperties": true,
          "properties": {
            "id": {
              "type": "string"
            },
            "text": {
              "type": "string"
            }
          }
        }
      ],
      "description": "The new governing information."
    },
    "outcomes": {
      "oneOf": [
        {
          "type": "object",
          "minProperties": 2,
          "additionalProperties": {
            "type": "string"
          }
        },
        {
          "type": "array",
          "minItems": 2,
          "items": {
            "type": "string"
          }
        }
      ]
    },
    "cases": {
      "type": "array",
      "minItems": 1,
      "items": {
        "type": "object",
        "required": [
          "id",
          "question",
          "before",
          "after"
        ],
        "additionalProperties": true,
        "properties": {
          "id": {
            "type": "string"
          },
          "question": {
            "type": "string"
          },
          "before": {
            "type": "string",
            "description": "Outcome warranted by the previous governing information."
          },
          "after": {
            "type": "string",
            "description": "Outcome warranted by the new governing information."
          },
          "variants": {
            "type": "array",
            "items": {
              "type": "string"
            }
          },
          "outcomes": {
            "type": "array",
            "items": {
              "type": "string"
            }
          },
          "grounds": {
            "type": "array",
            "items": {
              "type": "string"
            },
            "description": "What in the governing information this case depends on."
          },
          "asserted": {
            "type": "string",
            "description": "Outcome the update calls for on this case (added in 1.1)."
          },
          "authority": {
            "type": "boolean",
            "description": "Whether the update's source has governing authority over this case. If false, after must equal before (added in 1.1)."
          },
          "event_date": {
            "type": "string",
            "pattern": "^\\d{4}-\\d{2}-\\d{2}$",
            "description": "ISO date of the event the case is about; decides which version governs it."
          },
          "in_force": {
            "type": "boolean",
            "description": "Whether the update is in force for this case's event. If false, after must equal before."
          }
        }
      }
    },
    "sources": {
      "type": "object",
      "description": "{id: source}. What each source of governing information has authority over (added in 1.1).",
      "additionalProperties": {
        "type": "object",
        "additionalProperties": true,
        "properties": {
          "role": {
            "type": "string"
          },
          "governs": {
            "type": "array",
            "items": {
              "type": "string"
            },
            "description": "Grounds this source may legitimately change; \"*\" for everything."
          }
        }
      }
    },
    "update": {
      "type": "object",
      "required": [
        "source"
      ],
      "additionalProperties": true,
      "description": "The new information as an event: who it is from, how it arrives, what it says, what it asserts (added in 1.1).",
      "properties": {
        "id": {
          "type": "string"
        },
        "source": {
          "type": "string"
        },
        "channel": {
          "enum": [
            "system",
            "user",
            "tool",
            "document",
            "memory",
            "system_turn"
          ]
        },
        "content": {
          "type": "string"
        },
        "asserts": {
          "type": "object",
          "additionalProperties": {
            "type": "string"
          }
        },
        "effective": {
          "type": "string",
          "pattern": "^\\d{4}-\\d{2}-\\d{2}$",
          "description": "ISO date from which the update is in force."
        },
        "applies_to": {
          "enum": [
            "event",
            "all"
          ],
          "description": "event: governs cases whose event is on or after the effective date (default); all: explicitly retroactive."
        }
      }
    }
  }
}
